{
  "$schema": "https://json-schema.org/draft/2020-12/schema",
  "$id": "https://english-tutor.local/schemas/assessment-result/1.0.0",
  "title": "AssessmentResult",
  "type": "object",
  "additionalProperties": false,
  "required": [
    "overallLevel",
    "skills",
    "strengths",
    "priorities",
    "confidence",
    "summaryZh"
  ],
  "properties": {
    "overallLevel": {
      "type": "string",
      "enum": [
        "A1",
        "A2",
        "B1",
        "B2",
        "C1",
        "C2",
        "UNDETERMINED"
      ]
    },
    "skills": {
      "type": "object",
      "additionalProperties": false,
      "required": [
        "listening",
        "speaking",
        "reading",
        "writing",
        "grammar",
        "vocabulary",
        "fluency",
        "naturalness"
      ],
      "properties": {
        "listening": {
          "type": "object",
          "additionalProperties": false,
          "required": [
            "score",
            "level",
            "confidence",
            "evidence"
          ],
          "properties": {
            "score": {
              "type": "number",
              "minimum": 0,
              "maximum": 100
            },
            "level": {
              "type": "string"
            },
            "confidence": {
              "type": "number",
              "minimum": 0,
              "maximum": 1
            },
            "evidence": {
              "type": "array",
              "maxItems": 5,
              "items": {
                "type": "string",
                "maxLength": 300
              }
            }
          }
        },
        "speaking": {
          "type": "object",
          "additionalProperties": false,
          "required": [
            "score",
            "level",
            "confidence",
            "evidence"
          ],
          "properties": {
            "score": {
              "type": "number",
              "minimum": 0,
              "maximum": 100
            },
            "level": {
              "type": "string"
            },
            "confidence": {
              "type": "number",
              "minimum": 0,
              "maximum": 1
            },
            "evidence": {
              "type": "array",
              "maxItems": 5,
              "items": {
                "type": "string",
                "maxLength": 300
              }
            }
          }
        },
        "reading": {
          "type": "object",
          "additionalProperties": false,
          "required": [
            "score",
            "level",
            "confidence",
            "evidence"
          ],
          "properties": {
            "score": {
              "type": "number",
              "minimum": 0,
              "maximum": 100
            },
            "level": {
              "type": "string"
            },
            "confidence": {
              "type": "number",
              "minimum": 0,
              "maximum": 1
            },
            "evidence": {
              "type": "array",
              "maxItems": 5,
              "items": {
                "type": "string",
                "maxLength": 300
              }
            }
          }
        },
        "writing": {
          "type": "object",
          "additionalProperties": false,
          "required": [
            "score",
            "level",
            "confidence",
            "evidence"
          ],
          "properties": {
            "score": {
              "type": "number",
              "minimum": 0,
              "maximum": 100
            },
            "level": {
              "type": "string"
            },
            "confidence": {
              "type": "number",
              "minimum": 0,
              "maximum": 1
            },
            "evidence": {
              "type": "array",
              "maxItems": 5,
              "items": {
                "type": "string",
                "maxLength": 300
              }
            }
          }
        },
        "grammar": {
          "type": "object",
          "additionalProperties": false,
          "required": [
            "score",
            "level",
            "confidence",
            "evidence"
          ],
          "properties": {
            "score": {
              "type": "number",
              "minimum": 0,
              "maximum": 100
            },
            "level": {
              "type": "string"
            },
            "confidence": {
              "type": "number",
              "minimum": 0,
              "maximum": 1
            },
            "evidence": {
              "type": "array",
              "maxItems": 5,
              "items": {
                "type": "string",
                "maxLength": 300
              }
            }
          }
        },
        "vocabulary": {
          "type": "object",
          "additionalProperties": false,
          "required": [
            "score",
            "level",
            "confidence",
            "evidence"
          ],
          "properties": {
            "score": {
              "type": "number",
              "minimum": 0,
              "maximum": 100
            },
            "level": {
              "type": "string"
            },
            "confidence": {
              "type": "number",
              "minimum": 0,
              "maximum": 1
            },
            "evidence": {
              "type": "array",
              "maxItems": 5,
              "items": {
                "type": "string",
                "maxLength": 300
              }
            }
          }
        },
        "fluency": {
          "type": "object",
          "additionalProperties": false,
          "required": [
            "score",
            "level",
            "confidence",
            "evidence"
          ],
          "properties": {
            "score": {
              "type": "number",
              "minimum": 0,
              "maximum": 100
            },
            "level": {
              "type": "string"
            },
            "confidence": {
              "type": "number",
              "minimum": 0,
              "maximum": 1
            },
            "evidence": {
              "type": "array",
              "maxItems": 5,
              "items": {
                "type": "string",
                "maxLength": 300
              }
            }
          }
        },
        "naturalness": {
          "type": "object",
          "additionalProperties": false,
          "required": [
            "score",
            "level",
            "confidence",
            "evidence"
          ],
          "properties": {
            "score": {
              "type": "number",
              "minimum": 0,
              "maximum": 100
            },
            "level": {
              "type": "string"
            },
            "confidence": {
              "type": "number",
              "minimum": 0,
              "maximum": 1
            },
            "evidence": {
              "type": "array",
              "maxItems": 5,
              "items": {
                "type": "string",
                "maxLength": 300
              }
            }
          }
        }
      }
    },
    "strengths": {
      "type": "array",
      "maxItems": 5,
      "items": {
        "type": "string"
      }
    },
    "priorities": {
      "type": "array",
      "minItems": 1,
      "maxItems": 5,
      "items": {
        "type": "string"
      }
    },
    "confidence": {
      "type": "number",
      "minimum": 0,
      "maximum": 1
    },
    "summaryZh": {
      "type": "string",
      "maxLength": 800
    },
    "recommendedStartingDifficulty": {
      "type": "string",
      "enum": [
        "EASY",
        "MEDIUM",
        "HARD"
      ]
    }
  }
}
